Date,Time,Source,Title,Link
2026-04-05,06:53,MSN,"Inside the Pentagon, fears of a disrupted war effort after Army chief's ouster",https://news.google.com/rss/articles/CBMiXEFVX3lxTFBsdC14Y2NfU0NiSjJPc3I1d0lXZ2hsLUdRZDlzZGk4Q1RTQTZISnpkeHcwT092aWZyMk5hTWtKUEhqLXBRdUVCbU4xNWYyTHJ6X1FkNkkybnhzbHc3?oc=5
2026-04-05,11:26,The New York Times,U.S. Rescues Missing Air Force Officer Whose Fighter Jet Was Downed by Iran,https://news.google.com/rss/articles/CBMihgFBVV95cUxPZzBuZUExQnY1d1pyTndnTlBzM0lYR20xdUdJQlQ1M2R0UVN4Q0tiRWdGTlVmQmx1WmQ0R180TzdZQjFmdzc5cWQtTFptLWJIdFBxMmpKTFlvQWhNb3NfNHVOeFRrX3RnWUc2T2dtbHhtMU5TVVNDN2VJWnpYcElXd2tvb19SZw?oc=5
2026-04-04,16:13,time.com,What to Know About the Army Chief Hegseth Ousted—and the General Who’s Taking Over,https://news.google.com/rss/articles/CBMifEFVX3lxTE9WWUozZ3R4STRtWUZtdkd5TFVmZDNwRTlnVXFXTDlyUUJLX1YtQ2pVRjlRLVMxUlNBcVh4aURyWlF3OWNiUzFZYXdrdlpIR2VlbW5MNUY5OVBUTXpUdVI2THNWZVp5c3B5NzdvTEFfVGNKSXdWWDNRYlZKWGU?oc=5
2026-04-05,11:29,Online.UA,Pentagon reveals US combat losses in war against Iran,https://news.google.com/rss/articles/CBMikAFBVV95cUxPaF9nVmwxTENuamhORWZuQVdCY21nQXBrbWQ0aUp5M3R2V2NHOTVYazItVDByUnlPWlVDUVFaSks5Z2w5ZXFDM0VDVm5SSW05YVZwd3BhZmVSc3c3NGFrWTdoTUYtNmQ1S2xWVUdmSGJsQmNsZHZqVHdUY1hxSno2LXBWSTNfaGFrZE1DOFVzUTE?oc=5
2026-04-05,01:11,AOL.com,Pentagon says about 140 US troops wounded in Iran war,https://news.google.com/rss/articles/CBMifEFVX3lxTE5uQlBySkhMRVpLdG5oOFVlSmdGWW1jM2RaNFhSYktBZWVLdV9zdmdMQ1BqQkpnX3NTdHdlZjJHQWwxX0VzcEpoM2w2VkpEb0V0Y0NfVWtxLUI1eHZEbUdwYlhZSE5tYnZNZTJsb05xNTZTeklaUXVrMFB6R00?oc=5
2026-04-04,01:46,The Washington Post,Opinion | Hegseth’s firing of a top general is the latest sign of Pentagon turmoil,https://news.google.com/rss/articles/CBMilgFBVV95cUxOZlhBdFZTSUVSU0NzQUtMRDcta2U3ZndvZFo5dUZ6ZURRaWR6QVJ2RlU0NTlOdzcxM1prV0Q5aDg3Z2VxOUllb3dodHVTWVdoaWhlZGNNNmxIVE9EV09mbkZQT2hXc0x6RE5aTExtTkx6SXkxVG14TF9JT2Z1ZHh2NFRHLVZMOURhYlF4Y1lfT2pLc2JRdGc?oc=5
2026-04-03,22:56,The Daily Beast,Military’s Top Catholic Rebukes Pentagon Pete for War Boasts,https://news.google.com/rss/articles/CBMilAFBVV95cUxQVW1BYm1Rb1pKU3d1ZFppNXRqZE9ydjZ2T3dqOGZpWGtHSVp0Tm1IQWRPZ2hDdjlIcjlVVVA0T1h1dUVJNE04alRDb2hwVzA5S09QRlFRa1hXdGhjdzhtanlqRml4dTdJQnNwdlVUeHVKQl9aNWJwZTF4b0hxblJsWVJXRG5JNFBaVFcyN1YtemU4YWky?oc=5
2026-04-05,07:23,International Business Times,Hegseth Draws Scrutiny After Claims He Was 'Triggered' by Pope Leo's Anti-War Message Amid Curtailed Pentagon Catholic Services,https://news.google.com/rss/articles/CBMixAFBVV95cUxPWmN1TkVMbC0xVmZPWl9oLU5lZlp3UkZqcGJkbXM5Sk1zTHhidVpLZXdRa1llTkZ6NF9ncVNSY093Tk1uQTBIclpiU1k4M2tIT1NtcExEZVkydnF0ZDZtSXlBWk5GOFpKQ0lieUxocTM5aGxUVDE1TU8tYUYxbWFWQnhYODU5OTRSUjd4Ny1TOE9xd2p5SU1iWGJKRjFoT05RSmZ4S0hEcXBWUlZwcFRKeGQ2VExJdnpYWWFKTm5WUm9JM01w?oc=5
