Date,Time,Source,Title,Link
2026-06-20,09:07,MSN,Pentagon seeks $80B to fund Iran war and other costs,https://news.google.com/rss/articles/CBMi6wFBVV95cUxQVlFyQmlib2xhNDUwTlZVcU0zUmJMa2hiWWNhMmVPWTcwM2RNSjZBd1ZwZmtSdFJiVU1VTEN3cE95NUZLVlI2cXNINHdRSlg2OHJQOUR4QlhKTkN5Z0QxWEk5SThPSXpWdWExNTVERnI0SEpFRnl1RG0zUk9UZ0UtX3A1UlBpRjdMZEtUMkV1U1FwSG1xdVhqd1pUcjl1aDMwYk9sNDcxbFJDRUhtaE95dURVTVlpdTdEdktWYlRnVzBtWXRudU9CSmpjMHZuaGNfcEx0VkZDTlBmV19ET1FPaGRRNjhrY3lJYi1N?oc=5
2026-06-20,01:33,The Japan Times,Secret vetting and blocked promotions in the Pentagon: Inside Pete Hegseth’s war on diversity,https://news.google.com/rss/articles/CBMiigFBVV95cUxQWlpvRDdFUWZ5MEtQWVlhSjR3ZE1ZMGRvTFBoUzdTdHFBWWExaHk2RFFVS09Rb0VpYUl4NUFmQ3lfcVlSbGNadGEyaXJtYS11cHlMQ2hVM0JObWlpOTU0SUFuTkhNNGRsTERSUUR6VjdqVERlSkVvMHhPRk1xMGJXdHoyS1FSMDh6Zmc?oc=5
2026-06-19,05:00,MS NOW,The Pentagon says the Iran war cost $29 billion. Experts say it’s far more.,https://news.google.com/rss/articles/CBMiVkFVX3lxTE9uc1F3NTE3Sm81bjN2N21SOTZ1UVkxMHp4UmpYQjJwLXVpU1lLRFBIMTJDbGxkbE5JcVVqcExiLWwyNXE2ZEZJdFdQWDVaTE9WMVBMQkp3?oc=5
2026-06-20,09:16,Memeburn,"Pentagon Says Grok AI Helped Fire 2,000 Missiles At Iran In 2026",https://news.google.com/rss/articles/CBMijgFBVV95cUxPU3JIcG9WcWVXdm5HSkZKZ083WGRaSUJ0QTNrNGN5TURPV3RsNDFRcEpRVi02M1IzeHRXdlBjMzViWkdTZVowdDVJcW55eFoyM3JSTkl2T1E3Y0V3UV9Yck1uT0xTVTNVYXV3M2ZwWXB5TFJWZWp4aFlHWWtmSlpPUzkyaVJScnM2Z3JtdXRR?oc=5
2026-06-20,09:53,Mshale,"Exclusive Interview: Anthropic CEO Responds To Trump's Comments, Pentagon's Position Dsrb (kTydzE5Mtf)",https://news.google.com/rss/articles/CBMiW0FVX3lxTE5FQm5rWUxBYmhDZXJtcXIxNUlUUUdBN0dVRlExQUFBOGM3S1hMckRILVZQMDduNDI0N2h5dDZEU0RabUhUSENrS3l0ZGhHWWs0Y3FnaDVYLVFtams?oc=5
2026-06-20,02:30,Türkiye Today,Pentagon nears completion of Iran school strike probe,https://news.google.com/rss/articles/CBMinAFBVV95cUxPcFVFSjFtQ0ZVSFh4TERlTVBPMTBfYmhOM2VOSElpZjBFdW5ZSHZhQkEwMmI4UDJIc1E4REZqS3Foa1pyZC1EMXJpNWowM3dNTE5GZ01zWjNyN2ZNeHRrOHFDenZIWW5vdFhZNFptYnNTWF8tYkRWVmpWTmFCYndGRklLQTFkMFBEbFhQTUNJSDBFdkZzWTQ0RThEQ1E?oc=5
2026-06-19,10:25,The New York Times,Inside Hegseth’s War on Diversity and Blocked Promotions of Women and Black Officers,https://news.google.com/rss/articles/CBMimAFBVV95cUxQOF9aZnp6a0xCeWNLNllxQ3Zsb19ldFFWajZqelJJbW9KYTFCMUxGNXY3VmJHRXBsaGwyTGdTdXFFcFhkYjdJa21DSlR6NnRmX2NNYm5YeHRGdkFNYWlMQm1Wa2JrbldRTGhrSkpxRFN6UnlqNkozRGhGSzRoMlFRaUJLNW4yb2NQdjJOOWo3eTZZMnNFMTJXZg?oc=5
2026-06-19,02:23,"ABC News - Breaking News, Latest News and Videos",Senators seek to block Hegseth travel funds until Pentagon releases report on Iran school strike,https://news.google.com/rss/articles/CBMiowFBVV95cUxPdldsTHRod2ctV2VJcTRtUWh1Q2RQWHZUSk9EY0pKNWwzQXpCS01WREJVYmxHTUtEWHpDZkFmOWhCeVZrZG5lWGV1MGhfZzBxSS00STlTU09ucDhlQjhmSWszaG5vVTdKNWtZbG9HbHVJcUpxS1VTNnZHbW5CaXFOSXFRQk1TVXdqV1QwVmJhQV9mR0xpQUIxZXd2Y0liaTFncTM00gGoAUFVX3lxTE4tWnhEYjVjMEYtNnUyeWptOGV0RkJ3MmpHaHhVRnZsSDVyTU80cUdIZE5rRUF0QS1YZXNZaWhRcUtIbFp3dlo0X1VBTlNvZ3VlYjJGdjVacEJBY0o1blpoZFRSTmZKeS1xRGg4ZGQ2ZXluNENEdzNna1NsaUtfTU51VF9oSmJ0YTRDUTVwdU82a2tzaGFCQmsybHUwS3BLOWIwa254T0FHRQ?oc=5
