Date,Time,Source,Title,Link
2026-02-17,15:07,The Washington Post,Hegseth forces ouster of senior Army spokesman in latest internal clash,https://news.google.com/rss/articles/CBMioAFBVV95cUxPS2pleENDNlJqSWFsV3FPY082cDdDWUQ4WHE1U1IyUUdxWGhvLXkxR0k4WVllVzg1THR0ZTZMay00LVgwQzVwdmNNUnN3aE5Cc2dKamtpWXhRVUpNSmhVcUJIS2szenhLVEFlUklUZDhzaE84czBIVF94QXdEbjBLYkEwdFRubWJfNXZwSWRPMlNfNWVMSTJmWHpZdTJzY3Yt?oc=5
2026-02-17,04:12,Axios,"Exclusive: Pentagon warns Anthropic will ""pay a price"" as feud escalates",https://news.google.com/rss/articles/CBMiigFBVV95cUxPQjBuYmx6a2NKQVRydW1lcVJid1ItcFFKN3g5NkdYaUM1Qm5fZ1BXMm9ZUXpVcXAxNGV6ajlRa3ozaGJPTDVQQ0pkZ0Zxdlo0YmhBUmZkNEQ1SXIzdXVZcTktSFVUc200ZmtiMTQ3MzVTcEdsWDhwbGRDUG1XYjhUNTc0eWVpTklXa2c?oc=5
2026-02-17,15:25,DefenseScoop,Pentagon looking to scale AI-infused enterprise task management platform to more than 150K users,https://news.google.com/rss/articles/CBMimgFBVV95cUxPVjk1S1I3QW5HOGFCUU05V3QtRUhqVk1Ea294UGpEU3lLVHVIVWd6OVZYb1BHT0ZmN1lCTEJMeUtiaEtyQWFmV1VkaU9rUjJMckw1SHFqZUs0Z1ZxLUxFcXptTjFDWHdmWGpkNEdlQzZKdXZVeDdQSl9qb2JlNVhnNC1EUTRfQThpN2ZJZTE4ZHN5THR2TG1sQm5R?oc=5
2026-02-17,09:23,The New York Times,Hegseth Is Said to Have Ordered Pentagon Spokesman’s Firing,https://news.google.com/rss/articles/CBMijAFBVV95cUxPZlFxQW9pTXFTOGJnTXVDa2tueHpBMklXUS1KckttN2Vod2NVZGVOaVh2NkFLdTd3UVo5MURSelJheTNDMmUzSllENmdjQ0ZmV0ZQVHpvb3lINjY5MU94OVBXMUltc0xMWDhyOFpKYnNJM29PTFRKaDdzMEhYTEpSb2JaUlJQNTNEUWF3aQ?oc=5
2026-02-17,09:20,Facebook,"Breaking news: Defense Secretary Pete Hegseth forced the ouster of a senior military adviser to Army Secretary Dan Driscoll, officials said, marking the Pentagon chief’s latest intervention into the service’s internal affairs.",https://news.google.com/rss/articles/CBMi3AFBVV95cUxNbmExVHV6TmwzWEJzbTNGRDcwQnF3UzBhU1F6UWppRlJEZ2VfMnNZM3J6STlxcFJpVmRMV3BEYTRQbTM1eGVBZmJNdDRtZnlNZnpqUmdidGpQY0QzNUJxUFlBTWFvWFB1MXVVYjQ3RjRxeEZCQ2dKSFdaWXV0OVBFUkNlc1M5RUtNeERJem5YZ3ZCN2lEZXhYUjhiYm4wd3hiRVF5VTgwRnVWSFRjeUZyS1Rab2UtdHJmUjRUT0gxREFkYUJEcDIxUmlTLTNxRjR5UkFXaEYwT0Y2Y1ln?oc=5
2026-02-17,09:01,Fox News,SCOOP: Hegseth orders removal of Army public affairs chief amid broader Pentagon purge,https://news.google.com/rss/articles/CBMitgFBVV95cUxPS1Mtb25CZkRfRENKWXdpc3RXMmd4TGVRd1dFYzZxTWJxdzh4ZVg2endscldBZlBhc0c1Vkx6bG5YMmhBLTlHS3V2RzctZ0lsR2dJZGRkSW1ab0lpcHI5VlBmbEdlZzNHNHQzTkhVYVdyQ2xreml5d18yNWRPaFpuVTl0UXhpNjF4M1Y0UDNhVHVObTlFbk5KZktFakFoRGFVV21YSzhxSzJxeVpLdVBuQ00xVHhud9IBuwFBVV95cUxPTm5JRHo3S0RrbzNHa0k1b1ctekZuUldmdHN1cE44NklZUm1IU19xbTYwOW1hLS1QUFAwYWxKMDlMNUJIejRKWFNXMUJKSmFLa1djbG5TRFFGakdaUkpxSzVPaldoRTNUSGdmMHBWc2ttbXN4NUhHUXdTYjVwalBJd2tLR3N0ZjVOeUEtU3JITzdQekJzaGFHbnZWTmc5Vzk0Q1FaeHNLdEdHdkMxNmVFcjN0dXZsRGprVF9F?oc=5
2026-02-16,05:00,Military.com,Why the Pentagon Is Cutting Off Harvard and What That Means,https://news.google.com/rss/articles/CBMinAFBVV95cUxNY21JdUFILWNjcUd2WUNCbXo1VWZpdk1JSkFOaGRWbmVPc2EwNDBaa0dqS1JMemRmRFAwNjFTakxqVE9YTW11Q280bmYwQ0kwR1U2ZlY3M1BMN29QdGFjcTJ4bTZOMjZsZUhRQzNrSVV5SzZ2Z3ZGQ2FvdDRrSXViQ1dHRjYyQS11dXY2NnJUQmtFMEFibS1jVEhGWTI?oc=5
2026-02-17,04:39,Bitcoin.com News,Anthropic and the Pentagon Clash Over Claude’s Military and Mass‑Surveillance Uses,https://news.google.com/rss/articles/CBMitgFBVV95cUxNZjFzclBMRzZQSXVoZkxrT1FZOTZHblZCTFhncmdscHdjbVoxckZoMnNQUGsxbVlVTmN4aXRXMmJrc0xBVFdKWFJqeGZEbURtZkZ5XzVqSmR0XzByNGVPLTBLMHhYaDdsZkhKRjZFRGdWQUJFS0loNFBnRzZxQVdxcmVsZTE1RTlpSFJYYVF1Q2pieWZuQWxYQW1CQUthMHc5dmkxY3hNSmdWcGpGODJRMUhTQVlUUQ?oc=5
