Date,Time,Source,Title,Link
2026-07-22,03:30,CBS News,Pentagon identifies 4th service member killed in recent days as U.S. carries out more strikes,https://news.google.com/rss/articles/CBMikwFBVV95cUxPTnl2blBxN3hkcHpRclhTUVh1aEtCSDRKcTBPQXV3UmZFTExfVnExVEcxTW5uZlVRcEQyZDg1MXJ4SXNVUTl6cEdjR2Fla1pRQ1dzSWhoa1dJSlVtell4TXZ2YXNGbFRYRXFsc3hReHJDS0d6V0Q4Yk9KdkRMTEJWVk1OTWR4QWJRVVEtTldRZjBkRGM?oc=5
2026-07-22,04:56,The Daily Beast,Dem Star Humiliates Stuttering Pentagon Pete With War Questions,https://news.google.com/rss/articles/CBMimgFBVV95cUxOeUZQeTRQcWFraThvNmljb05pcTlkRENvWURlZHNvZTlmR0hTM0g4Z3I3LUNGdHRGUGZtdENyMlRUaWhBdy14MU5sdHcwSFdIUjlFMTBMYzBFeUpVdGJvM2xZdC01X2JKWm44eEdjdkE5X1lROGdhWHREaWIzTXQ5cUJtWmptQnlRaEVTdUVGYUNlZ0NTQlFaaDBB?oc=5
2026-07-21,22:50,The New York Times,Pentagon Identifies Soldier Killed and Another ‘Believed’ Killed in Iran War,https://news.google.com/rss/articles/CBMinAFBVV95cUxQRFBxZV82T0w1V3pQb0U0T21BWGxERzZfVGEybXJlbUxwVzF3czVQMmJTYVByV01MUXpSLU42clVySlpWeU5BTVljV0hhQVN6bTEwaFU2c1pROXhMT3FRQzdzT0xGc2o5Q1JZeGs5Mi1tdHo0RkUtS0c2UzlVOVlOb0R4TUE4MGtfcHhXWGRkTUN6XzF0b1pCdndDZHo?oc=5
2026-07-22,05:00,facebook.com,The Pentagon said nearly 100 U.S. troops have been injured in the war with Iran over the last two weeks. The disclosure came as the U.S. military identified two U.S. soldiers who were killed in a fatal attack on Friday night. https://wapo.st/44JgSlv,https://news.google.com/rss/articles/CBMi3gFBVV95cUxQd1pIWDBMZnQxYXJmZzhMUVdBdkNSd1dlMWUxQktWNkJ1bVI1ZGdBWE9vN202bkYybV9ZRUpXLVh0OU1SemE3QnY2eTlsQ0JCbXR6Q3l5UUU5azRKdFQ4a0FjZHdRQ2kzNVBiRWZrbmVQR2VmS3d6dGt5UUtmZFdUblliT1FyNUVreUxLanpueHdBLVUzUTlPRFprdnB6TnNyY0JCdWpSdUY1SkI4NTRJakZ1TWxnOUpRTzVYZXhnUkt2UTY1TVRsa3NjVGR3UTR6UHdXQWJidUJBTHB3bVE?oc=5
2026-07-21,19:13,Military Times,"Cost of Iran war rises to $37.5 billion, Pentagon requests $67.1 billion more",https://news.google.com/rss/articles/CBMi0wFBVV95cUxOZlZ5NG4wR29ORjYzWHJCYV9tMlN0cGRsRU1OZEZaRTc3THFpZ00xcXFyOWFwTDdzTjNDZVRBS1g0NHZqRU5mTDNQdjcyYUtZdjBXaDdJclBkU3dqNWx4U3lfbTA0RUpxbVF3YVN4U0lhemFPZHZ3WDVFMUlmZ0IwdjN4T1FQV1NHVmlvaGNKRjhSX1VUZC1mQ00xOXVhcFBqUVV3QzNqX1d2NDg4SXRqVmF1QXBzekpCNVhfZFd6U1VENW1tRUFBZkxGLW1pVkE4LTJB?oc=5
2026-07-21,11:29,Time Magazine,"Nearly 100 U.S. Troops Injured in Two Weeks Since Iran War Resumed, Says Pentagon",https://news.google.com/rss/articles/CBMilgFBVV95cUxNRlJOXy1nX0xQSDBRTXo4TDNPZEpicmVqTWpOZzMwRlg4aGNSV2hRa0xsVFc4ZWM0QjN5bWxfcDMtUmprblI5eUNtX1dMOGFDaXhFbTYtTHYxdDQ3M0xuMXQ0SXlFOWFhbnlyT1RyTmV5VGpnZTJKT2ZTelVGNF81clVweFpBdUxaTnNRRHN4VklTekpLbkE?oc=5
2026-07-21,17:36,NBC News,Pentagon leadership testifies on war funding as Trump says he has ‘no interest’ in Iran talks,https://news.google.com/rss/articles/CBMi4wFBVV95cUxNNVBfOVduTkZEUjRySnZJZ3dzb1JvdXlEUFRzOUw1Z1NUM2JFT1E3dUVxS2xGLWpaVkt2bURSd2dQR3l2NW5SWmlNaHUtNnNzWnNWV2ZnLXFvV1ppZDVTYng3ZDlLTVpkNE5UMzhGY1kwNU13MVZkdk8yZkM5V0UtSGcyaWNKeWJZUXpmeVpETkpuanU1M1pmWl9vZDh0QkZKbGhnTkFUdzMzaFdZMllZMnFCc1Fsd0VYQU1EMWlzRWxIb3EzUkVGVGtCRVp2R28zSnRIWVBIdlVUWG5fb1VkYWdXaw?oc=5
2026-07-21,18:37,Los Angeles Times,Pentagon seeks billions from Congress as concerns grow over prolonged Iran war,https://news.google.com/rss/articles/CBMiugFBVV95cUxQdFptZG9MZC1oNEYtSWF2TjhIX2dDSzNXSV8zdGtGMGFyVWlydWs3bHdpSmVuMDBtT0paSGlIek5panZxM2JhYzJiMDZ4eVdxZFQ4RzJsNm9WNnBuV1BKRWk2Q2VQY2NxMDF1cWZNem5LQ1J5S3hhbUJxOWxndUlMSjQxSnNMRkNLWW1ETlctV01JLTNUTi04X0ZUU0o5QzI3SVIxTW1vdS1jTDkya0E3aDk4U180eTFEZUE?oc=5
