Date,Time,Source,Title,Link
2026-02-23,05:34,Business Insider,"US military dogs died in poor kennel conditions as others fell ill, Pentagon watchdog says",https://news.google.com/rss/articles/CBMilwFBVV95cUxQek5kRk9mUjVVSWtTZnhLWm9hYWp3QVBpT2YtWVBpVEhaUnF2Y0FzTWx2MG91ZHJBekZoS0Q1Rk94b1VzQWtDRXp3aDVlQzBIa0JLZmNzNUJIU0ZzN1NobE5iTmdKYmFUMHNfWlRvVGZjTVljRmo4blR3WWplYlFrMHlxWlgwRm1HSlVfSi1JbFhNcjktTE4w?oc=5
2026-02-23,05:04,Axios,Scoop: Hegseth to meet Anthropic CEO as Pentagon threatens banishment,https://news.google.com/rss/articles/CBMihwFBVV95cUxOUnZDT1YzM0EyN2I5X2ljMkRnQlhVX2owQ0cyMHBRb2ZrS1dueEo3VF94OUJwY3FfdmoxU0IwMkRHLVBGMUlWMVdDTDBsRENub0RZUlVLa2dkWFI5aEV0Q0tld1RCMnNYX05feXhzWU9zRlNBRjJwSUdaMTNwOWFwTmZPUVJRS3M?oc=5
2026-02-23,06:51,Reuters,"US Defense Secretary Hegseth summons Anthropic CEO for tough talks over military use of Claude, Axios reports",https://news.google.com/rss/articles/CBMivwFBVV95cUxPeXdJeDRaZWN5dkJtN1RkWThtUGdCQ0duQzVybHREdUhVT0hDX1dTZ3dUSXlrUFZIWXA3YWdGVHJtcC1pOHpicHhVNmgwMWs5ZVpQTU1nSkZjblcyQTJ6NGtMV1d6WDFTbnlzUDQ1eGJqemVMM05pMkJWclZCZ294ZmpoVkhjR3hFUkNSd1M2cXN2T3oxSDY4d2J1X1p3VVh4dnZRYjR1cEVJemRIdW5HUUdyWVpzbkc4R0lxS2hRcw?oc=5
2026-02-23,07:51,Türkiye Today,Pentagon threatens to blacklist Anthropic over military use of AI model Claude,https://news.google.com/rss/articles/CBMiwgFBVV95cUxQQUlwdEExdG95QmpRaXF2cnRVTTBVRWptNkRPZkNiNUtEWW1IazVPOExRWEZFekEzSVNmSDY4d09oaHBLYjF0WDFuZ3hZMG5SS0tuRDdtQ28zdEprN3U5WmFGSTV0enBDYTJTMDJsTlBwcURkbG5qeTlad1pSYW12YjRaVzJUdXNfMDBRdzJiZ0pLRVNqcmZWZkZFbzRpQ0g5ci1rWmhkQmlrd3hXUjFJb1BRbmJEamFnUHJQS3dLMHZiUQ?oc=5
2026-02-23,00:39,New York Post,"US assets in Middle East positioned for ‘highly kinetic’ war, ex-Pentagon official warns",https://news.google.com/rss/articles/CBMixgFBVV95cUxQT0dpVmw3TTd1bExMd0JWZTBOcWYwTjAyUXo2X2JSLVdjaFdWOUFkM0w0SVVBMHhpUzRMMUdSZDNOck5FV1RMVkItYkdKckEySm0tdzVDYVVvUFdRaTkwUVVnVGZNNFNZTFNtUXhIZG5LNnRZSmtraUxwclIyTDI5eU5CQUxjN0ZGb1J2TDZocDZtTkZwSDVwVC0wZEd0N3FKbFFZdnJvdFpYcHNsSGJtbFhMSFUtV0RGVWN4bWxZNlIyYS10c2c?oc=5
2026-02-22,14:16,The Jerusalem Post,Pentagon Pizza Index ties pizza spikes to military action,https://news.google.com/rss/articles/CBMiX0FVX3lxTE1RQUkzQ1o1RkhMb3ZxQmVBREduSEpiNzVMMURHNzFQVDZPLVdHa3U3WEhWQmREUGptcUl1SDhINW1rMnRSZUJvZFdydHh2LU9RMjJSS2RLRTRHZ3U4S1FB?oc=5
2026-02-23,08:01,Duffel Blog,Pentagon reconsiders Harvard tuition assistance after learning Hegseth went there,https://news.google.com/rss/articles/CBMirgFBVV95cUxOdXpWR19UU3gxdlhGNEZkOGNwelRnY0t6RGpZRmR1T3B0YlJBbTJpVkRuLU4zSW5wOEdGNXk4c2dKXzB0T3ZLMWs3LUtibXdYNC01dE1VVkxEZjlKNjhBSFJFUjdCenJWQ2NnbGYtSDVXeGktRTFFdmp5OGRwVkVFdU43ZEd0Tno5RFk1T2lCSGlvM2M4c3ROZXN1NzNPMnJRUWRCZkpkOXltSEpmbkE?oc=5
2026-02-23,07:24,Fine Day 102.3,Pentagon Chief Calls AI Company Boss to High-Stakes Military Meeting,https://news.google.com/rss/articles/CBMixAFBVV95cUxOOTZreS1mNW9pb1MyTUtkc2EwNjJ0dFhkdVlZa2dfSU5xT2M3cUJsSHU5ZWlIX0Vua3VZSzk0bTZ6eHJJeEtTRjI5WG5GS21BUmgzUjhlYVYyaVg1LWpkMmlETm1xamNUZElNUEc5SWlicksyV0dFb0psVGx6RkszYWZVQ295d2o0U0RTWTFES1loblUwcHRZZkt3Z1NqMF93bnNBMUJSdDNYMGVTYlpob0VMNjYyN011dklqejl0NzJyRG1O?oc=5
