Date,Time,Source,Title,Link
2026-06-30,17:34,U.S. Representative Chrissy Houlahan (.gov),"Houlahan, Castro, Cisneros Slam Pentagon for Lackland Flu Outbreak, Push for Flu Vaccine Requirement",https://news.google.com/rss/articles/CBMidkFVX3lxTE5Va1NOSl84bjdCNk9xZm5tdmhlb3VobFYwVmxUUEV3TTV4bTl3M0VJMHBHRXZnX0NWT1l2U1pSM2owelhLR1cyeUhNcFBrR3Y4T0piZ0s3SFpIS2c1WGg2TmZwTVhYOHBDaGpzSDVWVjhwVkJXT2c?oc=5
2026-06-30,09:34,Breaking Defense,Pentagon seeks to hire ‘hundreds’ of software engineers for 2-year tours,https://news.google.com/rss/articles/CBMiqwFBVV95cUxOZlptSzVyR2FTbndrZHh5bHJ2Smx1ZV9RR19hRTJSWXFlWC11cU93clBMWkhjT3hxb2VpNzlOU0NmMEdPTy15ZjRJVmRBYjhHQXZYTzYyblFVWDNxaTNkRVVvdUYtSXpMTTFHMkVsdFRNZ0NVaFdfQlpTdVEzZU5aYWdLYnAzNXh3RlNsSVJmbWo5M3Rjb0V2R0tuRzNjNmJneHN1RGcta2lrSFk?oc=5
2026-06-30,14:03,San Antonio Report,The Pentagon’s flu vaccine policy change created an ‘epidemiological time bomb’ at Lackland,https://news.google.com/rss/articles/CBMiugFBVV95cUxQUldvLXZ0MzNsNF9zMzZ5RDBubllBaFNDQ25lV3pfMk1wMF92NTlwdU14SEFrQVdCQUpPQjZvODhCUmRCbWpIZXBoeVVlMEEwZktaamp6NVpBTTFhWlZRNUZfRUJ5akJGWGRyUkJOa0VZRmpmbXZQTjBBaWN4NVBIOGZlSEJqN2pEUkVQem00N04tdU0zUlBQVUhxbGNfWW1CcUJKRW5QUm1MZl83aEpnRmFTVkExVmhJbUE?oc=5
2026-06-30,16:38,MS NOW,Federal judge blocks Hegseth’s Pentagon press escort policy,https://news.google.com/rss/articles/CBMiigFBVV95cUxPR2tPTG9UdURTUmRjUkJuWDBNYlpCQk04MnRKeHM3V2Y5M3lXbWo5UmdSaURveXpnaTZfRmxOQWpUS1hfTV9xRDhrUzg5UjNlWXBQaXRxNC1xSVd0QTMzT084b0UyS2FQc21nQ2dORFRZRjhGX0lMenYxeWZTb0o0RTVRT2VjcmVrblE?oc=5
2026-06-30,09:00,The Onion,Palantir Acquires Pentagon For $800 Billion,https://news.google.com/rss/articles/CBMickFVX3lxTFBWN2dKbnMxb1JOeGdfSWZFZGIwWjhDYnJBaExDd0JldndPS2EwelllWkRFMUFIc0dfVllFOEx3am52WWF0Y21UZlhDYUd1MGtmd01oMzZIN2o0RDY0bWJmdGVvZm5faU5tLTRVd2N3ZnA0dw?oc=5
2026-06-29,18:38,Mahomet Daily,"Pentagon Slashes Military Faith Codes, Dropping 180 Minority and Secular Traditions from Official List",https://news.google.com/rss/articles/CBMixgFBVV95cUxNTDhXaXh3dGVGaEdvTlJFbWhYaUV2eXJJcWxlZnp3WW5MS2Jvby1MWWlvS0t2SUxBUm1BR08zOGFvMEdMUmFvbmtnNzRvLUhKTWsxMmd3OVJWRzdhOVM0SzA1eFBfRWQ0TF83a0xxVVcxYTBxZGdGbDMycDhrWk9uYXF2YVI1MWpJSm1QU3JPYVlmMGVteXp2aDBvLUlTaENEX0FwZkFfTWI2TlVrcnhMcFVvOTB2ay1hT2ZibFpBbUt3MW5YbVE?oc=5
2026-06-30,08:29,Investor's Business Daily,"Drone Company AeroVironment Skyrockets 30% After Revenue, Backlog Double",https://news.google.com/rss/articles/CBMingFBVV95cUxObG42UzJNTFZMRldjd3p6aXNhRlN6MUY3dWhVQUlMdk5KR0JzZWhBMXhhcmVkM1lRUGZ3Q1VHRzdBdFRXRVcwdlI3V3lENGNHN1MxSGthU2NmX0xWMEU1ckJwenh6Snptd0Q1WndfNnp4SEtIYlhQUDdYNnd2M2tKSExUdnFrNDAxd1RBUDZMYUcxY1JkNGkzMmNjQ3phQQ?oc=5
2026-06-30,14:34,Baird Maritime,FEATURE | European NATO allies join US defense drills amid tensions with Pentagon,https://news.google.com/rss/articles/CBMiwgFBVV95cUxOWVNVczVKMVhNbmJKd2RPNXR5R1d1Yzk5eXZCeGRmaE9ZWDRHbWFKdXlyWjJPSlVjUVcwN2NwYTdqMTRFQ0R4VlBZWmt5NTFvRi1fTDZsekx2U1ZaT1ZmWVY1TEYwVjd5Y2p1dG03RlVmTjVSbmFJZ1JyUHYyWThXXzh4SS1PQWNxNVQtMWJrWm52TGpKZ25kdTcyX1JOOWJsand1aFBVQmR0d00yUnItYWRiRXYtUHJuMkJrM2F3b2dDQQ?oc=5
