Date,Time,Source,Title,Link
2026-06-12,08:12,U.S. Department of War (.gov),Department of War Publishes Third Release of Unidentified Anomalous Phenomena Files on WAR.GOV/UFO,https://news.google.com/rss/articles/CBMi1AFBVV95cUxOVlJ2aHNkMUJYUUdySDRDQmMtVjlzMURseVVQY25WbGVRM2hneWdILVJ1ak9qb1hBZFRKV2tOeTJCMmlRa2Q1UDlycjk2M184eWlSM1RXLVdaMXdHalpvMmRZSE8yblFJWm9PZU5PN1hpbDhPbTRuOHl1RVhPUTBCVDhfSDdQTURMNjhXN0tyNU5Oa0Z6MmEyRFZsUXE2UFdSN1VnRnd0cEFTa1BBOWFsdzE3MHd5SHduNHoybHlyLXp4ODRzdTd3eDNsY2RNbkk2NDVvZg?oc=5
2026-06-11,22:14,The Washington Post,Pentagon’s hours-long lockdown is lifted after false anthrax alert,https://news.google.com/rss/articles/CBMipgFBVV95cUxOSGw2TWdYalhISG03VENvVHdCa0d4ay12STkwcWZ4MHZLNVYzemhQLUJEZElTN01pdXozWWpaN0xVVlBlOHVWa01zTDNzeGZtZERDcFZSWVRhYi1NbmNkZDlVTDZXVXBMRGJ0cjc0SlhSZkhHVkNmWHFHU0w0d1NrWFp3bGxMblhNNzBwY2dFdkNlM3lsQjREYUxEOGk4UnZvUUFqaFdn?oc=5
2026-06-12,09:42,The New York Times,Renewable Groups Ask Courts to End Pentagon’s ‘Total Halt’ of Wind Power,https://news.google.com/rss/articles/CBMiiAFBVV95cUxQMGtrWFNaWmVQY0UyUVJfNGxVVEN2aFQzZDY3OFZKeFgzbVpYUGp1eWgzQWJ5eF8xaXdYS2JuN1h3TzNuSHgxcGlGQUpyaThxVDA5U0ExcUxaMGFiUXJxRTFZelhxdDhOUTByaU1zMUdMYlRmWmVpckFkeHF1UDY4YXdycG5PSXp5?oc=5
2026-06-12,07:21,Endpoints News,WuXi AppTec sues Pentagon in challenge over inclusion on Chinese military list,https://news.google.com/rss/articles/CBMipAFBVV95cUxNVEl4YmQ1U1RFMFo5TWVoNTJfcDVPd2N4NjJhSW0wVWkyeGtIWVkwOTlpTTFuUGFjSUlwWWY4a21jQVJMeGlaTGlfc1QtSlJZdWFqU0xRdHNGOVFlRjlzSjlUSzFHN0F3c1ZOZGpuMG12VDVkdTRqU1EybEZoTzNlWmNDZWpZWW1nMEk5aDV1QmJ4TzBBdFc4VzhVOTV1dU1mMTZtRg?oc=5
2026-06-12,11:53,TMZ,New Stunning UFO-Related Videos Released by Pentagon,https://news.google.com/rss/articles/CBMiekFVX3lxTE1SQ2txSVZjYm1oaHJJN0tZSmtsV1FxUmlzU0dKMExKYzJUb0p2Zko3SEtNWTM3SFF6anh5b2NfMzlrcHd3blctc3p3Nm9ycEtySUNuMmdzb1hHS0V6eG0tMUZHbHhmZVRhZ2hWQ3ZXd0dHTEYwZnFoTW1B?oc=5
2026-06-11,17:30,PBS,A Pentagon list overhaul puts Mormon church’s Christian identity back in the spotlight,https://news.google.com/rss/articles/CBMivgFBVV95cUxNVjIwVWJhYzNBR0FUR2l2TVktUkd1S2pUdEhMM2JvakIyd3ZIUVNSdnJ6djFLUDluVm1Yam1YTmpkc0RNZXlONGpJSHhyQ2g2NzhaWDdUbG5GMjRNRmZkc0lRdzRucXZzWnRUejBvS2lzSnJHUlgyQWt3dDZtNHRLQWg2NXVkWmRLeFg1Zk00cUJHMUdsZkpGQk1NN1A5QU9jR0FBRE5JRldxV0EwQVpsMVptdXRvRFZPaFg3OVh3?oc=5
2026-06-12,06:07,WRAL,"Pentagon reviews are blocking wind farms, putting jobs at risk, lawsuit says",https://news.google.com/rss/articles/CBMirwFBVV95cUxOd24tQ2RnV3VKVlQySjY1azRDMkpSYUNORFBIdER3N3lkb0xzdHVsdXl4Umt4QzFYeFRhbTZtcUpkX2UwV0VsXzV2UTNkV3lOYTFTYnUwMFdCb0trRHFsbXR3ckVvNXNVSjBNSzhCM2d5alZSY0RTcjE1ZHhWNGN4THdkVXVyZk5pNS1iRnNWYWVGYWIwVEN1Wnc0NmNhQWtxWmpZUUdXa3RlR0hUUWgw?oc=5
2026-06-12,09:11,CBS News,"Pentagon releases 3rd batch of UFO files, detailing mysterious orb sightings: ""Are you seeing this?""",https://news.google.com/rss/articles/CBMigwFBVV95cUxQOThBb3E0X0N2czQwSjBFRmJ6djRJbzhPc2xxSmxMei1DbW1iY0NfZ3JZUVZyNXMwQVNMSnI5NFZBaXo2M3poT0oyNmZwTVhNTnJoZkJSRzQtSF9JREY5b042RVVrX2VOZ1FiSGViNEZmRGdfUDBMRzB5VnJ2RVRFYkYtdw?oc=5
