Date,Time,Source,Title,Link
2026-07-17,05:02,NPR,What will the Pentagon begin screening 'war fighters' for? The quiz knows,https://news.google.com/rss/articles/CBMimwFBVV95cUxQQ251SmtzTXBmUmFHeFcxUXg3ZDNSRnNpY3ZlbGRTWnZKMnMwTDVySlduQkplRXNaN28wVlo1Z0MwLWhyWHJ3Z2FsSkw3VFJELU9fZ1dQeHpzSXZiakdpaTNDQi1BdWhnb1RwWEt0TG51ZkV6V1ljcmdCaHYwblcyOE1XWWt4Vi13NUpyakNUbzZLaGtmVjViY0s3RQ?oc=5
2026-07-17,14:44,Military Times,"230 troops discharged for refusing COVID-19 vaccine have rejoined, Pentagon says",https://news.google.com/rss/articles/CBMi3AFBVV95cUxOUnVsRW05WWZRcFZiZ2hpUmRFVF9yanBoRFFFaTM2dUs5Rzl0Mlp0RDRCMFhfSzkwVmdQdFdVZkZHUHlMekJQQUlsU21kdHpxN2xsWUhsOU5EUWVSSnA1OWVBejFsckhSZDNqRnJiaEpmMnhhWXNYVFE0N29OaUN2SnV6Zm03T0lDT1pHWWRUQ2Q5SUVZUjhxcUdzYUdTYjNlWndyZmEyUFlqUUNfWlhSdmxvaDdoOHNSWi15TUdHRFJOWldTTW45VlprRlJZOVhsR1RqVHlabW1naWYx?oc=5
2026-07-17,05:02,VPM,What will the Pentagon begin screening 'war fighters' for? The quiz knows,https://news.google.com/rss/articles/CBMirwFBVV95cUxQREE1Wlh1WEtDZDBKelVES3FwUkRfUDN2X2dibllLQkxKSlc5VDdZcm82OEtESXFTek5WUDdHN2pYQ2ZSeWZRVTFIUXU4Q1pSX0VJSTFZZEhGZDNrdVhqOVNKbG9wQkpKMTVZVmxQN09xN2d5QlNMZWVGNWFLN2pYelYtdi1Hd2dWaV9lSWZJNkZhdE9RUmFCeDJPMnE4NTYtNXdHSEVoQnlzMl9lWndB?oc=5
2026-07-17,12:17,stripes.com,Military families welcome Pentagon decision to add middle school sports,https://news.google.com/rss/articles/CBMikgFBVV95cUxQN3hXU082V0pZTjNvbnZMdE1veDJGOWp2OEd6NVJjVV9Zb194V1E5SmlpMThidDg2aVVKVXVPN19xeENEMDdSZy15ZnFyMXBDRFBxRTFHVWdQQTJoZHo2Y0NwU21XMkNaNjA4ajRMMWVvRmFaUUxsQ2NERE1XYURibm1SRzA4dHBRS0EwYVFsY05LZw?oc=5
2026-07-17,12:47,The National Interest,Why the US Power Grid Is Central to Military Readiness,https://news.google.com/rss/articles/CBMiowFBVV95cUxQcUM0Q3VYY0J2TWtia1VxNnFLLU1GRExuajVxUGw5UjdvUzlDeXNJZWkta0h3UDFFOGFidWg0ZThfU3lyY25VT29BdW52M01TZllteDl3RWNlOWNycy10SmxlZkoyT1pSdGx3MnRtMVE0ck0yY0xja1lzbUEyd1U4TnNEeGZzUE1tRlpPSzhZdzFhVGwxZ25iUzYxTlp2UVlwbnJB?oc=5
2026-07-17,08:28,facebook.com,"DW News. . A US strike set a bridge ablaze in Iran's Bandar Khamir as Washington returned to hitting infrastructure in its war against Tehran. The Pentagon released new footage of jets and cruise missiles launching attacks overnight, while a surveillance tower",https://news.google.com/rss/articles/CBMi4gFBVV95cUxNcGFfSC1ocExDQ0lGWjJBbHN3czN2QWFUbHNBV21ISU1lenVTTzVpaGNhcVZpQ2xUb05yMUg0cUh5UWRLaUZ6SWRIWXpFckY2NGRLRnpOV1pRWXN3SWdZOVZHVjIwYS1Xa3F2em5xLV9BM3RjSVBtRFBWa0FfZlE3ZXpJWFVPckFudjZScV9iYUdCYUtMZWRUWHRVdl9RWWVRM1Rod1owSVdkNjVtaXNDRzNmZjJiUjF1Rkw2OGcyNjhZX0RoVkM5ZFBFcEhOUHlacUZiaTRxekRxTVJNQTZmaHhR?oc=5
2026-07-17,09:59,The Independent,"The Pentagon’s plans to screen military members for testosterone lacks scientific backing, medical experts warn",https://news.google.com/rss/articles/CBMiygFBVV95cUxNOHBQZ09sVVJTN1hJS184OG1iRWl0NlRHSEpGVUVIV2FLazdnU2VZMnNLbk40ck9KYmxlX2JQMW5pSEhUSEpHVTM3X0lwRDdRUGlYanRpaGRwMndHXzFPTzNxLXpfMnVybk1INkxGUUdzQXNKNTlOc3M0T3FOR1liVGZ6cHVrc1NyZDE3UC1EZVpZWGxmRzVCT1dRZ1pUQkthMkVXeEpmQUxEYl9fRGtVZ3JyclpmNS1GeFk4cmhqc1JMaTctQ05uM29B?oc=5
2026-07-17,05:02,STLPR,What will the Pentagon begin screening 'war fighters' for? The quiz knows,https://news.google.com/rss/articles/CBMiqwFBVV95cUxPTE82LXpKYXc1Sm5IQlc2OVJoVlVjSG5VRk92THg5bzNDV2pCZTNvWDBHX2JpU1dya1ZBdGJqYVdza2xzNHl2anVmTTZVb1psSEZwa1JNcVZ4TWpxVExpZzUyeWdWekNwdUFoOXNFYmc0R0ZzdEJPdGJWbEtfZWxHNGxmLTktN0JTRDViRXpGTURLTHZZbVdRMl9PTzJ2YTZ3enQ0dnZYNzBsdTQ?oc=5
